,Review,Lemma,Polarity,Analysis,Vader Sentiment,Vader Analysis
281,I  was so  disappointed.,  disappointed,-0.75,Negative,-0.4767,Neutral
282,Service stinks here!,  Service stink,0.0,Neutral,-0.4019,Neutral
283,I waited and waited.,  wait wait,0.0,Neutral,0.0,Neutral
284, it is not a quality mess.,  quality mess,-0.175,Negative,-0.3612,Neutral
285,I would definitely recommend the wings ,  would definitely recommend wing,0.0,Neutral,0.6369,Positive
286,Plis include Salads!,  Plis include Salads,0.0,Neutral,0.0,Neutral
287,Things that went wrong: - They burned the food,  Things go wrong burn food,-0.5,Negative,-0.4767,Neutral
288,We waited an hour for what was a breakfast I could have done 100 times better at home.,  wait hour breakfast could do time well home,0.0,Neutral,0.2732,Neutral
289,This place is amazing!,  place amaze,0.0,Neutral,0.5423,Positive
290,I hate this mess,  hate mess,-0.48750000000000004,Negative,-0.7351,Negative
291,Waited 2 hours still wasn't served meals,  Waited hour still serve meal,0.0,Neutral,0.0,Neutral
292,Just don't know why they were so slow.,  know slow,-0.30000000000000004,Negative,0.0,Neutral
293,"The staff is great, the food is delish, and they have an incredible beer selection.",  staff great food delish incredible beer selection,0.8500000000000001,Positive,0.6249,Positive
294,I live ihere so I am disappointed I won't be back here but i have no option,  live ihere disappointed back option,-0.20454545454545456,Negative,-0.4767,Neutral
295, soooo delicious.,  soooo delicious,1.0,Positive,0.5719,Positive
296,"You get incredibly fresh fish, prepared with care.",  get incredibly fresh fish prepare care,0.3,Positive,0.6997,Positive
297,i hate this place,  hate place,-0.8,Negative,-0.5719,Negative
298,I love the fact that everything on their menu is worth it.,  love fact everything menu worth,0.4,Positive,0.7269,Positive
299,Never again will I be dining at this place!,  Never din place,0.0,Neutral,0.0,Neutral
300,The food was excellent and service was very good.,  food excellent service good,0.85,Positive,0.765,Positive
301,good food selection.,  good food selection,0.7,Positive,0.4404,Neutral
302,Food was really boring.,  Food really boring,-1.0,Negative,-0.3804,Neutral
303,Good Service-check!,  Good Service check,0.7,Positive,0.4404,Neutral
